patch_id,objective,files_changed,status,verification_note
001,Create ramadhan_periods table + model + seeder,"database/migrations/2026_02_25_000001_create_ramadhan_periods_table.php; app/Models/RamadhanPeriod.php; database/seeders/RamadhanPeriodSeeder.php",done,"Migration ran successfully. Seeder populated 3 periods (1445H/2024, 1446H/2025, 1447H/2026). Model has dayToDate() helper for Hijriah-to-Masehi day mapping."
002,Controller + Routes,app/Http/Controllers/LaporanRamadhanCrmController.php; routes/web.php,done,"11 routes registered. Controller has: index view + apiPeriods/apiStorePeriod/apiUpdatePeriod/apiDeletePeriod (CRUD) + apiStats/apiPerbandinganCS/apiPerbandinganTim/apiTrendHarian/apiOptions (analytics). All queries dynamic from ramadhan_periods."
003,Blade view,resources/views/laporan-ramadhan/index.blade.php,done,"Full page: period stat cards with progress bars + CRUD modal for periods + filters (hari ramadhan/kumulatif/tim) + 3 tabs (Per CS/Per Tim/Trend Harian) + dynamic column generation per period."
004,Sidebar link update,resources/views/components/sidebar.blade.php,done,"Laporan Ramadhan link changed from coming-soon to route('laporan-ramadhan.index'). Active state added with auto-open dropdown and active indicator. Added laporan-ramadhan to active options list."
005,Add line chart perbandingan harian antar tahun,resources/views/laporan-ramadhan/index.blade.php,done,"Added Chart.js line chart between stat cards and filters. Uses existing trendSeries data (no new API). Enabled :chartjs=true on layout. Dynamic datasets/colors per period. Chart re-renders on filter change. Proper destroy before re-render. No regression on existing tabs/modals."
