Phase,Task,Status,Notes,Timestamp
1,Buat checkpoint file,DONE,File tracking untuk semua phase,2024-12-04
2,Audit sidebar analisis-donatur sebagai template,DONE,Struktur sidebar sudah diidentifikasi,2024-12-04
3,Buat sidebar component blade,DONE,resources/views/components/sidebar.blade.php created,2024-12-04
4,Update analisis-donatur untuk pakai component,DONE,Inline sidebar replaced dengan x-sidebar active=dashboard,2024-12-04
5,Test analisis-donatur dengan component,DONE,No errors - route donatur.index verified,2024-12-04
6,Update performa-cs untuk pakai component,DONE,Sidebar replaced + showMobileMenu renamed to sidebarOpen,2024-12-04
7,Test performa-cs dengan component,DONE,No errors found,2024-12-04
8,Update monitor-cs untuk pakai component,DONE,Inline sidebar replaced dengan x-sidebar active=monitor-cs,2024-12-04
9,Test monitor-cs dengan component,DONE,No errors found,2024-12-04
10,Update laporan-perolehan untuk pakai component,DONE,Inline sidebar replaced dengan x-sidebar active=laporan-perolehan,2024-12-04
11,Test laporan-perolehan dengan component,DONE,No errors found,2024-12-04
12,Update donatur untuk pakai component,DONE,Inline sidebar replaced dengan x-sidebar active=donatur,2024-12-04
13,Test donatur dengan component,DONE,No errors found,2024-12-04
14,Final verification semua halaman,DONE,Semua 5 halaman menggunakan sidebar component,2024-12-04
