Phase,Task,Description,Status,Priority,Dependencies,Notes
1,1.1,Analisis struktur UI Analisis Donatur yang ada,completed,high,none,Head - CSS - Sidebar - Header - Loading modal identified
1,1.2,Identifikasi komponen yang bisa di-reuse,completed,high,1.1,Semua komponen UI bisa di-reuse dengan modifikasi
1,1.3,Backup file performa-cs/index.blade.php lama,completed,medium,none,Saved as index.blade.php.backup
2,2.1,Redesign HEAD section (meta - css - tailwind config),completed,high,1.2,Samakan dengan analisis-donatur - DONE
2,2.2,Redesign STYLE section,completed,high,2.1,Copy CSS dari analisis-donatur - DONE
2,2.3,Redesign Loading Modal,completed,medium,2.2,Gunakan style loading yang sama - DONE
3,3.1,Redesign Sidebar - structure,completed,high,2.3,Exact copy dari analisis-donatur - DONE
3,3.2,Update Sidebar - active state untuk Performa CS,completed,high,3.1,Tandai menu CS > Performa CS sebagai active - DONE
3,3.3,Redesign Header section,completed,high,3.2,Copy header dari analisis-donatur - DONE with filters
4,4.1,Redesign Main Content - Overview Cards,completed,high,3.3,5 cards dengan style light mode - DONE
4,4.2,Redesign Main Content - H2H Section,completed,high,4.1,Table dan filter dengan style light - DONE
4,4.3,Redesign Main Content - Leaderboard Section,completed,high,4.2,Cards dengan style light - DONE
4,4.4,Redesign Main Content - CS List Section,completed,medium,4.3,Grid cards dengan style light - DONE
4,4.5,Redesign Main Content - Insights Section,completed,medium,4.4,Alert boxes dengan style light - DONE
5,5.1,Redesign CS Detail Modal,completed,medium,4.5,Modal dengan style light - DONE
5,5.2,Redesign Charts (H2H Bar - Trend Line),completed,medium,5.1,Chart.js dengan color scheme untuk light mode - DONE
6,6.1,Keep existing Alpine.js logic,completed,high,5.2,Logic tetap sama - hanya update style
6,6.2,Keep existing API calls,completed,high,6.1,API calls tetap sama
6,6.3,Update color references di JS jika perlu,completed,medium,6.2,Chart colors updated for light mode
7,7.1,Testing halaman setelah redesign,not-started,high,6.3,Cek semua fitur masih berfungsi
7,7.2,Verify sidebar navigation,not-started,high,7.1,Pastikan navigasi antar halaman konsisten
7,7.3,Final review dan cleanup,not-started,medium,7.2,Remove mobile sidebar duplicate - DONE
